Source: USDA National Nutrient Database for Standard Reference 28 Software v.3.7.1 2017-03-29,,,,
Nutrients: Phenylalanine (g),,,,
Food Subset:All Foods,,,,
Ordered by:Food Name,,,,
Measured by:Household,,,,
Report Run at: 04-19-2017T03:37,,,,
NDB_NO,Description,Weight(g),Measure,"Phenylalanine(g)Per Measure
14006"
14003,Alcoholic beverage beer regular all,29.7,1.0 fl oz,0
14034,Alcoholic beverage creme de menthe 72 proof,33.6,1.0 fl oz,0
14533,Alcoholic beverage distilled all (gin rum vodka whiskey) 100 proof,27.8,1.0 fl oz,0
14037,Alcoholic beverage distilled all (gin rum vodka whiskey) 80 proof,27.8,1.0 fl oz,0
14550,Alcoholic beverage distilled all (gin rum vodka whiskey) 86 proof,27.8,1.0 fl oz,0
14551,Alcoholic beverage distilled all (gin rum vodka whiskey) 90 proof,27.8,1.0 fl oz,0
14532,Alcoholic beverage distilled all (gin rum vodka whiskey) 94 proof,27.8,1.0 fl oz,0
14049,Alcoholic beverage distilled gin 90 proof,27.8,1.0 fl oz,0
14050,Alcoholic beverage distilled rum 80 proof,27.8,1.0 fl oz,0
14051,Alcoholic beverage distilled vodka 80 proof,27.8,1.0 fl oz,0
14415,Alcoholic beverage liqueur coffee with cream 34 proof,31.1,1.0 fl oz,0.042
20001,Amaranth grain uncooked,193,1.0 cup,1.046
11700,Amaranth leaves cooked boiled drained with salt,132,1.0 cup,0.15
11004,Amaranth leaves cooked boiled drained without salt,132,1.0 cup,0.15
11003,Amaranth leaves raw,28,1.0 cup,0.037
36000,APPLEBEES 9 oz house sirloin steak,157,1.0 serving,1.76
36023,APPLEBEES chicken tenders platter,209,1.0 serving,1.705
36005,APPLEBEES chicken tenders from kids menu,35,1.0 piece,0.266
36019,APPLEBEES chili,136,1.0 cup,0.645
36021,APPLEBEES coleslaw,76,1.0 serving,0.013
36022,APPLEBEES crunchy onion rings,350,1.0 serving,0.697
36001,APPLEBEES Double Crunch Shrimp,206,1.0 serving,1.133
36018,APPLEBEES fish hand battered,250,1.0 serving,1.35
36003,APPLEBEES KRAFT Macaroni  &  Cheese from kids menu,124,1.0 cup,0.339
36004,APPLEBEES mozzarella sticks,32,1.0 piece,0.281
9008,Apples canned sweetened sliced drained heated,204,1.0 cup slices,0.01
9007,Apples canned sweetened sliced drained unheated,204,1.0 cup slices,0.01
9010,Apples dehydrated (low moisture) sulfured stewed,193,1.0 cup,0.015
9009,Apples dehydrated (low moisture) sulfured uncooked,60,1.0 cup,0.022
9013,Apples dried sulfured stewed with added sugar,280,1.0 cup,0.017
9012,Apples dried sulfured stewed without added sugar,255,1.0 cup,0.015
9011,Apples dried sulfured uncooked,86,1.0 cup,0.022
9015,Apples frozen unsweetened heated,206,1.0 cup slices,0.016
9014,Apples frozen unsweetened unheated,173,1.0 cup slices,0.014
9501,Apples raw golden delicious with skin,109,1.0 cup sliced,0.008
9500,Apples raw red delicious with skin,109,1.0 cup sliced,0.008
9003,Apples raw with skin,125,1.0 cup quartered or chopped,0.007
9004,Apples raw without skin,110,1.0 cup slices,0.008
9006,Apples raw without skin cooked microwave,170,1.0 cup slices,0.014
9402,Applesauce canned sweetened with salt,255,1.0 cup,0.013
9020,Applesauce canned sweetened without salt (includes USDA commodity),246,1.0 cup,0.012
9401,Applesauce canned unsweetened with added ascorbic acid,244,1.0 cup,0.012
9019,Applesauce canned unsweetened without added ascorbic acid (includes USDA commodity),244,1.0 cup,0.012
9029,Apricots canned extra heavy syrup pack without skin solids and liquids,246,1.0 cup whole without pits,0.057
9025,Apricots canned extra light syrup pack with skin solids and liquids,247,1.0 cup halves,0.062
9027,Apricots canned heavy syrup pack with skin solids and liquids,258,1.0 cup halves,0.057
9028,Apricots canned heavy syrup pack without skin solids and liquids,258,1.0 cup whole without pits,0.054
9024,Apricots canned juice pack with skin solids and liquids,244,1.0 cup halves,0.063
9026,Apricots canned light syrup pack with skin solids and liquids,253,1.0 cup halves,0.056
9022,Apricots canned water pack with skin solids and liquids,243,1.0 cup halves,0.073
9023,Apricots canned water pack without skin solids and liquids,227,1.0 cup whole without pits,0.064
9031,Apricots dehydrated (low-moisture) sulfured stewed,249,1.0 cup,0.199
9030,Apricots dehydrated (low-moisture) sulfured uncooked,119,1.0 cup,0.242
9034,Apricots dried sulfured stewed with added sugar,270,1.0 cup halves,0.132
9033,Apricots dried sulfured stewed without added sugar,250,1.0 cup halves,0.055
9032,Apricots dried sulfured uncooked,130,1.0 cup halves,0.081
9035,Apricots frozen sweetened,242,1.0 cup,0.063
9021,Apricots raw,155,1.0 cup halves,0.081
20003,Arrowroot flour,128,1.0 cup,0.015
11015,Asparagus canned drained solids,242,1.0 cup,0.123
11707,Asparagus canned no salt added solids and liquids,122,0.5 cup,0.052
11013,Asparagus canned regular pack solids and liquids,122,0.5 cup,0.052
11012,Asparagus cooked boiled drained,90,0.5 cup,0.074
11705,Asparagus cooked boiled drained with salt,90,0.5 cup,0.074
11709,Asparagus frozen cooked boiled drained with salt,180,1.0 cup,0.126
11019,Asparagus frozen cooked boiled drained without salt,180,1.0 cup,0.126
11018,Asparagus frozen unprepared,58,4.0 spears,0.044
11011,Asparagus raw,134,1.0 cup,0.1
9037,Avocados raw all commercial varieties,150,1.0 cup cubes,0.146
9038,Avocados raw California,230,1.0 cup pureed,0.219
9039,Avocados raw Florida,230,1.0 cup pureed,0.248
3997,Babyfood Baby MUM MUM Rice Biscuits,8,4.0 biscuit,0.024
3995,Babyfood banana with mixed berries strained,99,1.0 packet,0.035
3301,Babyfood beverage GERBER GRADUATE FRUIT SPLASHERS,113,4.0 oz,0.002
3681,Babyfood cereal barley prepared with whole milk,28.35,1.0 oz,0.051
3682,Babyfood cereal high protein prepared with whole milk,28.35,1.0 oz,0.126
3185,Babyfood cereal mixed dry fortified,2.5,1.0 tbsp,0.017
3685,Babyfood cereal mixed prepared with whole milk,28.35,1.0 oz,0.057
3188,Babyfood cereal mixed with applesauce and bananas junior fortified,28.35,1.0 oz,0.018
3187,Babyfood cereal mixed with applesauce and bananas strained,28.35,1.0 oz,0.018
3186,Babyfood cereal mixed with bananas dry,2.5,1.0 tbsp,0.014
3686,Babyfood cereal mixed with bananas prepared with whole milk,28.35,1.0 oz,0.051
3689,Babyfood cereal oatmeal prepared with whole milk,28.35,1.0 oz,0.063
3192,Babyfood cereal oatmeal with applesauce and bananas junior fortified,28.35,1.0 oz,0.019
3191,Babyfood cereal oatmeal with applesauce and bananas strained,28.35,1.0 oz,0.019
3190,Babyfood cereal oatmeal with bananas dry,15,1.0 serving,0.094
3690,Babyfood cereal oatmeal with bananas prepared with whole milk,28.35,1.0 oz,0.051
3194,Babyfood cereal Rice dry fortified,2.5,1.0 tbsp,0.009
3694,Babyfood cereal rice prepared with whole milk,28.35,1.0 oz,0.045
3195,Babyfood cereal rice with applesauce and bananas strained,16,1.0 tbsp,0.009
3212,Babyfood cereal rice with bananas dry,2.5,1.0 tbsp,0.01
3712,Babyfood cereal rice with bananas prepared with whole milk,28.35,1.0 oz,0.046
3198,Babyfood cereal with egg yolks junior,28.35,1.0 oz,0.026
3197,Babyfood cereal with egg yolks strained,28.35,1.0 oz,0.026
3934,Babyfood corn and sweet potatoes strained,28.35,1.0 oz,0.015
3245,Babyfood dessert custard pudding vanilla strained,229,1.0 cup,0.167
3221,Babyfood dessert dutch apple junior,28.35,1.0 oz,0.002
3226,Babyfood dessert fruit pudding orange strained,28.35,1.0 oz,0.012
3049,Babyfood dinner beef and rice toddler,28.35,1.0 oz,0.056
3043,Babyfood dinner beef lasagna toddler,28.35,1.0 oz,0.052
3287,Babyfood dinner beef noodle junior,16,1.0 tbsp,0.019
3052,Babyfood dinner beef stew toddler,28.35,1.0 oz,0.057
3072,Babyfood dinner chicken stew toddler,16,1.0 tbsp,0.034
3090,Babyfood dinner macaroni and cheese junior,28.35,1.0 oz,0.037
3045,Babyfood dinner macaroni and tomato and beef junior,16,1.0 tbsp,0.018
3304,Babyfood dinner potatoes with cheese and ham toddler,28.35,1.0 oz,0.045
3051,Babyfood dinner spaghetti and tomato and meat toddler,28.35,1.0 oz,0.068
3054,Babyfood dinner vegetables and beef junior,256,1.0 cup,0.248
3053,Babyfood dinner vegetables and beef strained,256,1.0 cup,0.264
3067,Babyfood dinner vegetables and lamb junior,28.35,1.0 oz,0.024
3066,Babyfood dinner vegetables and lamb strained,256,1.0 cup,0.212
3994,Babyfood fruit banana and strawberry junior,140,1.0 bottle,0.074
3001,Babyfood juice treats fruit medley toddler,28,1.0 packet,0
3959,Babyfood mashed cheddar potatoes and broccoli toddlers,170,1.0 container,0.087
3014,Babyfood meat chicken sticks junior,10,1.0 stick,0.067
3013,Babyfood meat chicken junior,15,1.0 tbsp,0.09
3012,Babyfood meat chicken strained,15,1.0 tbsp,0.084
3009,Babyfood meat ham junior,28.35,1.0 oz,0.163
3008,Babyfood meat ham strained,15,1.0 tbsp,0.08
3011,Babyfood meat lamb junior,28.35,1.0 oz,0.17
3021,Babyfood meat meat sticks junior,10,1.0 stick,0.061
3007,Babyfood meat pork strained,28.35,1.0 oz,0.162
3017,Babyfood meat turkey sticks junior,10,1.0 stick,0.061
3015,Babyfood meat turkey strained,15,1.0 tbsp,0.088
3019,Babyfood snack GERBER GRADUATE FRUIT  STRIPS Real Fruit Bars,9.9,1.0 bar,0
3302,Babyfood snack GERBER GRADUATES YOGURT MELTS,7,1.0 serving,0.044
3098,Babyfood vegetables beets strained,224,1.0 cup,0.04
3100,Babyfood vegetables carrots junior,224,1.0 cup,0.056
3099,Babyfood vegetables carrots strained,224,1.0 cup,0.054
3120,Babyfood vegetables corn creamed junior,240,1.0 cup,0.118
3119,Babyfood vegetables corn creamed strained,113,1.0 jar,0.055
3283,Babyfood vegetables garden vegetable strained,28.35,1.0 oz,0.025
3092,Babyfood vegetables green beans junior,240,1.0 cup,0.118
3091,Babyfood vegetables green beans strained,240,1.0 cup,0.127
3282,Babyfood vegetables mix vegetables junior,99,1.0 serving 3.5 oz serving,0.054
3286,Babyfood vegetables mix vegetables strained,28.35,1.0 oz,0.013
3127,Babyfood vegetables spinach creamed strained,240,1.0 cup,0.23
3108,Babyfood vegetables sweet potatoes strained,224,1.0 cup,0.139
3109,Babyfood vegetables sweet potatoes junior,224,1.0 cup,0.137
7921,Bacon and beef sticks,28,1.0 oz,0.243
16104,Bacon meatless,144,1.0 cup,0.88
10994,Bacon pre-sliced reduced/low sodium unprepared,26,1.0 slice,0.135
7974,Bacon turkey low sodium,15,1.0 serving,0.088
18005,Bagels cinnamon-raisin,26,1.0 mini bagel (2-1/2 dia),0.123
18006,Bagels cinnamon-raisin toasted,24,1.0 mini bagel (2-1/2 dia),0.122
18003,Bagels egg,28.35,1.0 oz,0.148
18007,Bagels oat bran,26,1.0 mini bagel (2-1/2 dia),0.137
18002,Bagels plain enriched with calcium propionate (includes onion poppy sesame) toasted,24,1.0 mini bagel (2-1/2 dia),0.138
18406,Bagels plain enriched without calcium propionate (includes onion poppy sesame),28.35,1.0 oz,0.147
18407,Bagels plain unenriched with calcium propionate (includes onion poppy sesame),28.35,1.0 oz,0.147
18408,Bagels plain unenriched without calcium propionate(includes onion poppy sesame),28.35,1.0 oz,0.147
19077,Baking chocolate unsweetened liquid,28.35,1.0 oz,0.166
19078,Baking chocolate unsweetened squares,29,1.0 oz square Bakers,0.152
11028,Bamboo shoots canned drained solids,131,1.0 cup (1/8 slices),0.079
11712,Bamboo shoots cooked boiled drained with salt,120,1.0 cup (1/2 slices),0.064
11027,Bamboo shoots cooked boiled drained without salt,120,1.0 cup (1/2 slices),0.064
11026,Bamboo shoots raw,151,1.0 cup (1/2 slices),0.136
9041,Bananas dehydrated or banana powder,100,1.0 cup,0.201
9040,Bananas raw,225,1.0 cup mashed,0.11
7001,Barbecue loaf pork beef,28.35,1.0 oz,0.181
20130,Barley flour or meal,148,1.0 cup,0.872
20131,Barley malt flour,162,1.0 cup,0.365
20004,Barley hulled,184,1.0 cup,1.288
20006,Barley pearled cooked,157,1.0 cup,0.199
20005,Barley pearled raw,200,1.0 cup,1.112
2044,Basil fresh,2.5,5.0 leaves,0.003
16302,Beans adzuki mature seed cooked boiled with salt,230,1.0 cup,0.915
16003,Beans adzuki mature seeds canned sweetened,296,1.0 cup,0.595
16002,Beans adzuki mature seeds cooked boiled without salt,230,1.0 cup,0.915
16001,Beans adzuki mature seeds raw,197,1.0 cup,2.072
16006,Beans baked canned plain or vegetarian,254,1.0 cup,0.678
16007,Beans baked canned with beef,266,1.0 cup,0.875
16008,Beans baked canned with franks,259,1.0 cup,0.904
16009,Beans baked canned with pork,253,1.0 cup,0.721
16010,Beans baked canned with pork and sweet sauce,249,1.0 cup,0.642
16011,Beans baked canned with pork and tomato sauce,246,1.0 cup,0.585
16005,Beans baked home prepared,253,1.0 cup,0.726
16018,Beans black turtle mature seeds canned,240,1.0 cup,0.854
16317,Beans black turtle mature seeds cooked boiled with salt,185,1.0 cup,0.818
16017,Beans black turtle mature seeds cooked boiled without salt,185,1.0 cup,0.818
16016,Beans black turtle mature seeds raw,184,1.0 cup,2.114
16316,Beans black mature seeds canned low sodium,240,1.0 cup,0.854
16315,Beans black mature seeds cooked boiled with salt,172,1.0 cup,0.824
16015,Beans black mature seeds cooked boiled without salt,172,1.0 cup,0.824
16014,Beans black mature seeds raw,194,1.0 cup,2.266
16021,Beans cranberry (roman) mature seeds canned,260,1.0 cup,0.78
16320,Beans cranberry (roman) mature seeds cooked boiled with salt,177,1.0 cup,0.894
16020,Beans cranberry (roman) mature seeds cooked boiled without salt,177,1.0 cup,0.894
16019,Beans cranberry (roman) mature seeds raw,195,1.0 cup,2.428
16323,Beans french mature seeds cooked boiled with salt,177,1.0 cup,0.674
16023,Beans french mature seeds cooked boiled without salt,177,1.0 cup,0.674
16022,Beans french mature seeds raw,184,1.0 cup,1.871
16026,Beans great northern mature seeds canned,262,1.0 cup,1.14
16326,Beans great northern mature seeds canned low sodium,262,1.0 cup,1.14
16325,Beans great northern mature seeds cooked boiled with salt,177,1.0 cup,0.798
16025,Beans great northern mature seeds cooked boiled without salt,177,1.0 cup,0.798
16024,Beans great northern mature seeds raw,183,1.0 cup,2.163
16029,Beans kidney all types mature seeds canned,256,1.0 cup,0.791
16328,Beans kidney all types mature seeds cooked boiled with salt,177,1.0 cup,0.83
16028,Beans kidney all types mature seeds cooked boiled without salt,177,1.0 cup,0.904
16027,Beans kidney all types mature seeds raw,184,1.0 cup,2.346
16331,Beans kidney california red mature seeds cooked boiled with salt,177,1.0 cup,0.874
16031,Beans kidney california red mature seeds cooked boiled without salt,177,1.0 cup,0.874
16030,Beans kidney california red mature seeds raw,184,1.0 cup,2.425
11029,Beans kidney mature seeds sprouted raw,184,1.0 cup,0.39
16145,Beans kidney red mature seeds canned drained solids,266,1.0 can drained solids,1.253
16335,Beans kidney red mature seeds canned drained solids rinsed in tap water,158,1.0 cup cup rinsed solids,0.757
16337,Beans kidney red mature seeds canned solids and liquid low sodium,256,1.0 cup,0.812
16034,Beans kidney red mature seeds canned solids and liquids,256,1.0 cup,0.812
16333,Beans kidney red mature seeds cooked boiled with salt,177,1.0 cup,0.83
16033,Beans kidney red mature seeds cooked boiled without salt,177,1.0 cup,0.83
16032,Beans kidney red mature seeds raw,184,1.0 cup,2.241
16336,Beans kidney royal red mature seeds cooked boiled with salt,177,1.0 cup,0.908
16036,Beans kidney royal red mature seeds cooked boiled without salt,177,1.0 cup,0.908
16035,Beans kidney royal red mature seeds raw,184,1.0 cup,2.521
11626,Beans mung mature seeds sprouted canned drained solids,125,1.0 cup,0.075
16039,Beans navy mature seeds canned,262,1.0 cup,1.163
16338,Beans navy mature seeds cooked boiled with salt,182,1.0 cup,0.857
16038,Beans navy mature seeds cooked boiled without salt,182,1.0 cup,0.857
16037,Beans navy mature seeds raw,208,1.0 cup,2.409
11046,Beans navy mature seeds sprouted raw,104,1.0 cup,0.322
16341,Beans pink mature seeds cooked boiled with salt,169,1.0 cup,0.828
16041,Beans pink mature seeds cooked boiled without salt,169,1.0 cup,0.828
16040,Beans pink mature seeds raw,210,1.0 cup,2.379
16146,Beans pinto canned drained solids,277,1.0 can drained solids,0.997
16345,Beans pinto mature seeds canned drained solids rinsed in tap water,169,1.0 cup,0.613
16044,Beans pinto mature seeds canned solids and liquids,240,1.0 cup,0.569
16347,Beans pinto mature seeds canned solids and liquids low sodium,240,1.0 cup,0.569
16343,Beans pinto mature seeds cooked boiled with salt,171,1.0 cup,0.77
16043,Beans pinto mature seeds cooked boiled without salt,171,1.0 cup,0.908
16042,Beans pinto mature seeds raw,193,1.0 cup,2.113
16346,Beans small white mature seeds cooked boiled with salt,179,1.0 cup,0.868
16046,Beans small white mature seeds cooked boiled without salt,179,1.0 cup,0.868
16045,Beans small white mature seeds raw,215,1.0 cup,2.453
11058,Beans snap canned all styles seasoned solids and liquids,114,0.5 cup,0.034
11729,Beans snap green canned no salt added drained solids,153,1.0 cup,0.063
11726,Beans snap green canned no salt added solids and liquids,120,0.5 cup,0.035
11056,Beans snap green canned regular pack drained solids,135,1.0 cup,0.051
11054,Beans snap green canned regular pack solids and liquids,240,1.0 cup,0.07
11723,Beans snap green cooked boiled drained with salt,125,1.0 cup,0.086
11053,Beans snap green cooked boiled drained without salt,125,1.0 cup,0.086
11062,Beans snap green frozen all styles microwaved,111,1.0 cup,0.073
11060,Beans snap green frozen all styles unprepared,121,1.0 cup,0.08
11061,Beans snap green frozen cooked boiled drained without salt,135,1.0 cup,0.073
11731,Beans snap green frozen cooked boiled drained with salt,135,1.0 cup,0.073
11052,Beans snap green raw,100,1.0 cup 1/2 pieces,0.067
11933,Beans snap yellow canned no salt added drained solids,153,1.0 cup,0.064
11728,Beans snap yellow canned no salt added solids and liquids,120,0.5 cup,0.035
11932,Beans snap yellow canned regular pack drained solids,153,1.0 cup,0.064
11727,Beans snap yellow canned regular pack solids and liquids,120,0.5 cup,0.035
11725,Beans snap yellow cooked boiled drained with salt,125,1.0 cup,0.086
11724,Beans snap yellow cooked boiled drained without salt,125,1.0 cup,0.086
11730,Beans snap yellow frozen all styles unprepared,121,1.0 cup,0.08
11733,Beans snap yellow frozen cooked boiled drained with salt,135,1.0 cup,0.073
11732,Beans snap yellow frozen cooked boiled drained without salt,135,1.0 cup,0.073
11722,Beans snap yellow raw,100,1.0 cup 1/2 pieces,0.067
16051,Beans white mature seeds canned,262,1.0 cup,1.027
16350,Beans white mature seeds cooked boiled with salt,179,1.0 cup,0.942
16050,Beans white mature seeds cooked boiled without salt,179,1.0 cup,0.942
16049,Beans white mature seeds raw,202,1.0 cup,2.551
16348,Beans yellow mature seeds cooked boiled with salt,177,1.0 cup,0.878
16048,Beans yellow mature seeds cooked boiled without salt,177,1.0 cup,0.878
16047,Beans yellow mature seeds raw,196,1.0 cup,2.332
23491,Beef composite separable lean only trimmed to 1/8 fat choice cooked,85,3.0 oz,0.983
22402,Beef macaroni with tomato sauce frozen entree reduced fat,269,1.0 serving,0.654
22529,Beef Pot Pie frozen entree prepared,268,1.0 pie cooked (average weight),0.801
7956,Beef sausage fresh cooked,43,1.0 serving,0.323
7954,Beef sausage pre-cooked,48,1.0 serving,0.264
22905,Beef stew canned entree,196,1.0 cup (1 serving),0.288
23293,Beef Australian imported grass-fed ground 85% lean / 15% fat raw,114,4.0 oz (4 oz),0.768
23302,Beef Australian imported grass-fed loin tenderloin steak/roast boneless separable lean and fat raw,114,4.0 oz,0.896
23294,Beef Australian imported grass-fed loin tenderloin steak/roast boneless separable lean only raw,114,4.0 oz,0.927
23305,Beef Australian imported grass-fed loin top loin steak/roast boneless separable lean and fat raw,114,4.0 oz,0.805
23303,Beef Australian imported grass-fed loin top loin steak/roast boneless separable lean only raw,114,4.0 oz,0.969
23315,Beef Australian imported grass-fed loin top sirloin cap-off steak/roast boneless separable lean and fat raw,114,4.0 oz,0.962
23306,Beef Australian imported grass-fed loin top sirloin cap-off steak/roast boneless separable lean only raw,114,4.0 oz,0.974
23316,Beef Australian imported grass-fed rib ribeye steak/roast lip-on boneless separable lean and fat raw,114,4.0 oz,0.809
23307,Beef Australian imported grass-fed rib ribeye steak/roast lip-on boneless separable lean only raw,114,4.0 oz,0.954
23317,Beef Australian imported grass-fed round bottom round steak/roast boneless separable lean and fat raw,114,4.0 oz,0.927
23308,Beef Australian imported grass-fed round bottom round steak/roast boneless separable lean only raw,114,4.0 oz,0.951
23318,Beef Australian imported grass-fed round top round cap-off steak/roast boneless separable lean and fat raw,114,4.0 oz,0.988
23309,Beef Australian imported grass-fed round top round cap-off steak/roast boneless separable lean only raw,114,4.0 oz,0.995
23304,Beef Australian imported Wagyu loin tenderloin steak/roast boneless separable lean and fat Aust. marble score 4/5 raw,114,4.0 oz,0.866
23323,Beef Australian imported Wagyu loin tenderloin steak/roast boneless separable lean and fat Aust. marble score 9 raw,114,4.0 oz,0.815
23295,Beef Australian imported Wagyu loin tenderloin steak/roast boneless separable lean only Aust. marble score 4/5 raw,114,4.0 oz,0.897
23310,Beef Australian imported Wagyu loin tenderloin steak/roast boneless separable lean only Aust. marble score 9 raw,114,4.0 oz,0.839
23319,Beef Australian imported Wagyu loin top loin steak/roast boneless separable lean and fat Aust. marble score 4/5 raw,114,4.0 oz,0.735
23311,Beef Australian imported Wagyu loin top loin steak/roast boneless separable lean only Aust. marble score 4/5 raw,114,4.0 oz,0.895
23312,Beef Australian imported Wagyu loin top loin steak/roast boneless separable lean only Aust. marble score 9 raw,114,4.0 oz,0.752
23320,Beef Australian imported Wagyu loin top loin steak/roast separable lean and fat Aust. marble score 9 raw,114,4.0 oz,0.6
23321,Beef Australian imported Wagyu rib small end rib steak/roast boneless separable lean and fat Aust. marble score 4/5 raw,114,4.0 oz,0.695
23322,Beef Australian imported Wagyu rib small end rib steak/roast boneless separable lean and fat Aust. marble score 9 raw,114,4.0 oz,0.588
23313,Beef Australian imported Wagyu rib small end rib steak/roast boneless separable lean only Aust. marble score 4/5 raw,114,4.0 oz,0.904
23314,Beef Australian imported Wagyu rib small end rib steak/roast boneless separable lean only Aust. marble score 9 raw,114,4.0 oz,0.783
13953,Beef bottom sirloin tri-tip roast separable lean and fat trimmed to 0 fat all grades cooked roasted,569,1.0 roast (yield from 690g raw meat),5.855
13954,Beef bottom sirloin tri-tip roast separable lean and fat trimmed to 0 fat all grades raw,85,3.0 oz,0.693
13955,Beef bottom sirloin tri-tip roast separable lean and fat trimmed to 0 fat choice cooked roasted,85,3.0 oz,0.862
13956,Beef bottom sirloin tri-tip roast separable lean and fat trimmed to 0 fat choice raw,85,3.0 oz,0.693
13957,Beef bottom sirloin tri-tip roast separable lean and fat trimmed to 0 fat select cooked roasted,85,3.0 oz,0.887
13958,Beef bottom sirloin tri-tip roast separable lean and fat trimmed to 0 fat select raw,85,3.0 oz,0.693
23646,Beef bottom sirloin tri-tip roast separable lean only trimmed to 0 fat all grades raw,85,3.0 oz,0.714
23647,Beef bottom sirloin tri-tip roast separable lean only trimmed to 0 fat choice cooked roasted,85,3.0 oz,0.884
23648,Beef bottom sirloin tri-tip roast separable lean only trimmed to 0 fat choice raw,85,3.0 oz,0.711
23649,Beef bottom sirloin tri-tip roast separable lean only trimmed to 0 fat select cooked roasted,85,3.0 oz,0.912
23650,Beef bottom sirloin tri-tip roast separable lean only trimmed to 0 fat select raw,85,3.0 oz,0.717
13595,Beef brisket flat half boneless separable lean only trimmed to 0 fat all grades raw,85,3.0 oz,0.711
13904,Beef brisket flat half boneless separable lean and fat trimmed to 0 fat all grades raw,85,3.0 oz,0.657
13975,Beef brisket flat half boneless separable lean and fat trimmed to 0 fat choice raw,85,3.0 oz,0.652
13983,Beef brisket flat half boneless separable lean and fat trimmed to 0 fat select raw,85,3.0 oz,0.666
13596,Beef brisket flat half boneless separable lean only trimmed to 0 fat choice raw,85,3.0 oz,0.706
13597,Beef brisket flat half boneless separable lean only trimmed to 0 fat select raw,85,3.0 oz,0.721
13369,Beef brisket flat half separable lean and fat trimmed to 0 fat all grades cooked braised,85,3.0 oz,1.105
13165,Beef brisket flat half separable lean and fat trimmed to 0 fat choice cooked braised,85,3.0 oz,1.081
13950,Beef brisket flat half separable lean and fat trimmed to 0 fat select cooked braised,85,3.0 oz,1.128
13806,Beef brisket flat half separable lean and fat trimmed to 1/8 fat all grades cooked braised,85,3.0 oz,0.925
13805,Beef brisket flat half separable lean and fat trimmed to 1/8 fat all grades raw,85,3.0 oz,0.646
23660,Beef brisket flat half separable lean and fat trimmed to 1/8 fat choice cooked braised,85,3.0 oz,0.962
23658,Beef brisket flat half separable lean and fat trimmed to 1/8 fat choice raw,85,3.0 oz,0.609
13055,Beef brisket flat half separable lean and fat trimmed to 1/8 fat select cooked braised,85,3.0 oz,0.972
23659,Beef brisket flat half separable lean and fat trimmed to 1/8 fat select raw,85,3.0 oz,0.597
13370,Beef brisket flat half separable lean only trimmed to 0 fat all grades cooked braised,85,3.0 oz,1.117
13343,Beef brisket flat half separable lean only trimmed to 0 fat choice cooked braised,85,3.0 oz,1.095
13485,Beef brisket flat half separable lean only trimmed to 0 fat select cooked braised,85,3.0 oz,1.138
23595,Beef brisket flat half separable lean only trimmed to 1/8 fat all grades cooked braised,28.35,1.0 oz,0.371
23596,Beef brisket flat half separable lean only trimmed to 1/8 fat all grades raw,28.35,1.0 oz,0.242
23615,Beef brisket flat half separable lean only trimmed to 1/8 fat choice cooked braised,28.35,1.0 oz,0.371
23613,Beef brisket flat half separable lean only trimmed to 1/8 fat choice raw,28.35,1.0 oz,0.243
23634,Beef brisket flat half separable lean only trimmed to 1/8 fat select cooked braised,28.35,1.0 oz,0.371
