9211,Orange juice chilled includes from concentrate with added calcium,249,1.0 cup,0.027
9210,Orange juice chilled includes from concentrate with added calcium and vitamin D,249,1.0 cup,0.027
9506,Orange juice chilled includes from concentrate with added calcium and vitamins A D E,249,1.0 cup,0.027
9214,Orange juice frozen concentrate unsweetened undiluted,262,1.0 cup,0.113
9213,Orange juice frozen concentrate unsweetened undiluted with added calcium,262,1.0 cup,0.113
9206,Orange juice raw,248,1.0 cup,0.022
9200,Oranges raw all commercial varieties,180,1.0 cup sections,0.056
9201,Oranges raw California valencias,180,1.0 cup sections without membranes,0.061
9203,Oranges raw Florida,185,1.0 cup sections without membranes,0.043
9202,Oranges raw navels,165,1.0 cup sections without membranes,0.035
9205,Oranges raw with peel,170,1.0 cup,0.073
5643,Ostrich fan raw,85,1.0 serving ( cooked from 4oz raw),0.765
5642,Ostrich ground cooked pan-broiled,93,1.0 patty,1.003
5641,Ostrich ground raw,109,1.0 patty,0.909
5645,Ostrich inside leg cooked,85,1.0 serving ( 3 oz ),1.017
5644,Ostrich inside leg raw,85,1.0 serving ( cooked from 4 oz raw ),0.785
5647,Ostrich inside strip cooked,85,1.0 serving ( 3 oz ),1.03
5646,Ostrich inside strip raw,85,1.0 serving (cooked from 4 oz raw),0.831
5648,Ostrich outside leg raw,85,1.0 serving (cooked from 4 oz raw),0.802
5650,Ostrich outside strip cooked,85,1.0 serving ( 3 oz ),1.001
5649,Ostrich outside strip raw,85,1.0 serving (cooked from 4 oz raw),0.819
5652,Ostrich oyster cooked,85,1.0 serving ( 3 oz ),1.011
5651,Ostrich oyster raw,85,1.0 serving ( cooked from 4 oz raw),0.756
5653,Ostrich round raw,85,1.0 serving (cooked from 4 oz raw),0.772
5654,Ostrich tenderloin raw,85,1.0 serving (cooked from 4 oz raw),0.774
5656,Ostrich tip trimmed cooked,85,1.0 serving ( 3 oz ),1
5655,Ostrich tip trimmed raw,85,1.0 serving ( cooked from 4 oz raw),0.767
5658,Ostrich top loin cooked,85,1.0 serving ( 3 oz ),0.987
5657,Ostrich top loin raw,85,1.0 serving (cooked from 4 oz raw),0.76
7935,Oven-roasted chicken breast roll,56,1.0 serving 2 oz,0.315
18288,Pancakes plain frozen ready-to-heat (includes buttermilk),28.35,1.0 oz,0.061
18294,Pancakes blueberry prepared from recipe,28.35,1.0 oz,0.086
18295,Pancakes buckwheat dry mix incomplete,28.35,1.0 oz,0.138
18390,Pancakes buttermilk prepared from recipe,28.35,1.0 oz,0.096
18289,Pancakes plain dry mix complete (includes buttermilk),52,0.333 cup,0.257
18290,Pancakes plain dry mix complete prepared,28.35,1.0 oz,0.072
18291,Pancakes plain dry mix incomplete (includes buttermilk),28.35,1.0 oz,0.14
18292,Pancakes plain dry mix incomplete prepared,28.35,1.0 oz,0.109
18293,Pancakes plain prepared from recipe,28.35,1.0 oz,0.09
18297,Pancakes special dietary dry mix,28.35,1.0 oz,0.128
18299,Pancakes whole-wheat dry mix incomplete,28.35,1.0 oz,0.18
18300,Pancakes whole-wheat dry mix incomplete prepared,28.35,1.0 oz,0.119
21286,PAPA JOHNS 14 Cheese Pizza Thin Crust,87,1.0 slice,0.577
21284,PAPA JOHNS 14 Pepperoni Pizza Original Crust,123,1.0 slice,0.806
21285,PAPA JOHNS 14 The Works Pizza Original Crust,153,1.0 slice,0.796
9226,Papayas raw,145,1.0 cup 1 pieces,0.013
11297,Parsley fresh,60,1.0 cup chopped,0.087
20321,Pasta cooked enriched with added salt,124,1.0 cup spaghetti not packed,0.363
20121,Pasta cooked enriched without added salt,124,1.0 cup spaghetti not packed,0.363
20521,Pasta cooked unenriched with added salt,124,1.0 cup spaghetti not packed,0.368
20421,Pasta cooked unenriched without added salt,124,1.0 cup spaghetti not packed,0.368
20120,Pasta dry enriched,91,1.0 cup spaghetti,0.608
20420,Pasta dry unenriched,91,1.0 cup spaghetti,0.608
20093,Pasta fresh-refrigerated plain as purchased,128,4.5 oz,0.694
20094,Pasta fresh-refrigerated plain cooked,128,2.0 oz,0.316
20095,Pasta fresh-refrigerated spinach as purchased,128,4.5 oz,0.717
20096,Pasta fresh-refrigerated spinach cooked,57,2.0 oz,0.144
20654,Pasta gluten-free brown rice flour cooked TINKYADA,169,1.0 cup spaghetti not packed,0.294
20657,Pasta gluten-free corn and rice flour cooked,141,1.0 cup spaghetti,0.247
20655,Pasta gluten-free corn flour and quinoa flour cooked ANCIENT HARVEST,166,1.0 cup spaghetti packed,0.246
20092,Pasta gluten-free corn cooked,140,1.0 cup,0.181
20091,Pasta gluten-free corn dry,105,1.0 cup,0.384
20097,Pasta homemade made with egg cooked,57,2.0 oz,0.149
20098,Pasta homemade made without egg cooked,57,2.0 oz,0.121
20125,Pasta whole-wheat cooked,117,1.0 cup spaghetti not packed,0.349
7925,Pastrami beef 98% fat-free,57,1.0 serving 6 slices,0.354
7052,Pastrami turkey,57,2.0 slices,0.408
5282,Pate de foie gras canned (goose liver pate) smoked,13,1.0 tbsp,0.074
7053,Pate chicken liver canned,13,1.0 tbsp,0.09
7054,Pate goose liver smoked canned,13,1.0 tbsp,0.074
7055,Pate liver not specified canned,13,1.0 tbsp,0.076
7942,Pate truffle flavor,56,1.0 serving 2 oz,0.326
9242,Peaches canned extra heavy syrup pack solids and liquids,262,1.0 cup halves or slices,0.039
9239,Peaches canned extra light syrup solids and liquids,247,1.0 cup halves or slices,0.032
9241,Peaches canned heavy syrup pack solids and liquids,262,1.0 cup,0.037
9370,Peaches canned heavy syrup drained,222,1.0 cup,0.024
9238,Peaches canned juice pack solids and liquids,250,1.0 cup,0.05
9240,Peaches canned light syrup pack solids and liquids,251,1.0 cup halves or slices,0.035
9237,Peaches canned water pack solids and liquids,244,1.0 cup halves or slices,0.034
9245,Peaches dehydrated (low-moisture) sulfured stewed,242,1.0 cup,0.152
9244,Peaches dehydrated (low-moisture) sulfured uncooked,116,1.0 cup,0.179
9248,Peaches dried sulfured stewed with added sugar,270,1.0 cup,0.089
9247,Peaches dried sulfured stewed without added sugar,258,1.0 cup,0.093
9246,Peaches dried sulfured uncooked,160,1.0 cup halves,0.182
9250,Peaches frozen sliced sweetened,250,1.0 cup thawed,0.05
9243,Peaches spiced canned heavy syrup pack solids and liquids,242,1.0 cup whole,0.031
9236,Peaches yellow raw,154,1.0 cup slices,0.029
16097,Peanut butter chunk style with salt,32,2.0 tbsp,0.379
16397,Peanut butter chunk style without salt,32,2.0 tbsp,0.379
16098,Peanut butter smooth style with salt,32,2.0 tbsp,0.385
16398,Peanut butter smooth style without salt,32,2.0 tbsp,0.385
16099,Peanut flour defatted,60,1.0 cup,1.623
16100,Peanut flour low fat,60,1.0 cup,1.051
16088,Peanuts all types cooked boiled with salt,63,1.0 cup in shell edible yield,0.441
16090,Peanuts all types dry-roasted with salt,28.35,1.0 oz,0.348
16390,Peanuts all types dry-roasted without salt,146,1.0 cup,1.791
16089,Peanuts all types oil-roasted with salt,144,1.0 cup chopped,2.055
16389,Peanuts all types oil-roasted without salt,144,1.0 cup,2.055
16087,Peanuts all types raw,28.35,1.0 oz,0.39
16092,Peanuts spanish oil-roasted with salt,147,1.0 cup,2.134
16392,Peanuts spanish oil-roasted without salt,147,1.0 cup,2.134
16091,Peanuts spanish raw,146,1.0 cup,1.98
16094,Peanuts valencia oil-roasted with salt,144,1.0 cup,2.019
16394,Peanuts valencia oil-roasted without salt,144,1.0 cup,2.019
16093,Peanuts valencia raw,146,1.0 cup,1.898
16096,Peanuts virginia oil-roasted with salt,143,1.0 cup,1.918
16396,Peanuts virginia oil-roasted without salt,143,1.0 cup,1.918
16095,Peanuts virginia raw,146,1.0 cup,1.907
9340,Pears asian raw,122,1.0 fruit 2-1/4 high x 2-1/2 dia,0.016
9258,Pears canned extra heavy syrup pack solids and liquids,266,1.0 cup halves,0.013
9255,Pears canned extra light syrup pack solids and liquids,247,1.0 cup halves,0.02
9257,Pears canned heavy syrup pack solids and liquids,266,1.0 cup,0.013
9254,Pears canned juice pack solids and liquids,248,1.0 cup halves,0.022
9256,Pears canned light syrup pack solids and liquids,251,1.0 cup halves,0.013
9253,Pears canned water pack solids and liquids,244,1.0 cup halves,0.012
9261,Pears dried sulfured stewed with added sugar,280,1.0 cup halves,0.064
9260,Pears dried sulfured stewed without added sugar,255,1.0 cup halves,0.061
9259,Pears dried sulfured uncooked,180,1.0 cup halves,0.088
9252,Pears raw,140,1.0 cup slices,0.015
9412,Pears raw bartlett,140,1.0 cup sliced,0.015
9414,Pears raw bosc,140,1.0 cup sliced,0.014
9415,Pears raw green anjou,140,1.0 cup sliced,0.018
9413,Pears raw red anjou,126,1.0 small,0.013
11816,Peas and carrots canned no salt added solids and liquids,255,1.0 cup,0.201
11318,Peas and carrots canned regular pack solids and liquids,255,1.0 cup,0.201
11817,Peas and carrots frozen cooked boiled drained with salt,80,0.5 cup,0.09
11323,Peas and carrots frozen cooked boiled drained without salt,278,1.0 package (10 oz) yields,0.317
11322,Peas and carrots frozen unprepared,70,0.5 cup,0.087
11324,Peas and onions canned solids and liquids,120,1.0 cup,0.143
11818,Peas and onions frozen cooked boiled drained with salt,180,1.0 cup,0.166
11327,Peas and onions frozen cooked boiled drained without salt,180,1.0 cup,0.166
11326,Peas and onions frozen unprepared,69,0.5 cup,0.099
11301,Peas edible-podded boiled drained without salt,160,1.0 cup,0.168
11809,Peas edible-podded cooked boiled drained with salt,160,1.0 cup,0.168
11810,Peas edible-podded frozen cooked boiled drained with salt,160,1.0 cup,0.179
11303,Peas edible-podded frozen cooked boiled drained without salt,160,1.0 cup,0.179
11302,Peas edible-podded frozen unprepared,144,1.0 cup,0.13
11300,Peas edible-podded raw,98,1.0 cup chopped,0.088
11308,Peas green (includes baby and lesuer types) canned drained solids unprepared,175,1.0 cup,0.289
11311,Peas green canned drained solids rinsed in tap water,257,1.0 can,0.517
11813,Peas green canned no salt added drained solids,85,0.5 cup,0.139
11812,Peas green canned no salt added solids and liquids,124,0.5 cup,0.146
11306,Peas green canned regular pack solids and liquids,124,0.5 cup,0.141
11310,Peas green canned seasoned solids and liquids,227,1.0 cup,0.259
11811,Peas green cooked boiled drained with salt,160,1.0 cup,0.317
11305,Peas green cooked boiled drained without salt,160,1.0 cup,0.317
11814,Peas green frozen cooked boiled drained with salt,80,0.5 cup,0.152
11313,Peas green frozen cooked boiled drained without salt,80,0.5 cup,0.152
11312,Peas green frozen unprepared,134,1.0 cup,0.257
11304,Peas green raw,145,1.0 cup,0.29
16085,Peas green split mature seeds raw,197,1.0 cup,2.23
11316,Peas mature seeds sprouted raw,120,1.0 cup,0.301
16386,Peas split mature seeds cooked boiled with salt,196,1.0 cup,0.753
16086,Peas split mature seeds cooked boiled without salt,196,1.0 cup,0.753
2064,Peppermint fresh,0.1,2.0 leaves,0
7057,Pepperoni beef and pork sliced,85,3.0 oz,0.661
11978,Peppers ancho dried,17,1.0 pepper,0.061
11980,Peppers chili green canned,139,1.0 cup,0.031
11962,Peppers hot chile sun-dried,37,1.0 cup,0.121
11329,Peppers hot chili green canned pods excluding seeds solids and liquids,73,1.0 pepper,0.02
11670,Peppers hot chili green raw,45,1.0 pepper,0.028
11820,Peppers hot chili red canned excluding seeds solids and liquids,73,1.0 pepper,0.02
11819,Peppers hot chili red raw,45,1.0 pepper,0.028
11981,Peppers hungarian raw,27,1.0 pepper,0.007
11632,Peppers jalapeno canned solids and liquids,136,1.0 cup chopped,0.039
11335,Peppers sweet green canned solids and liquids,140,1.0 cup halves,0.035
11822,Peppers sweet green cooked boiled drained with salt,11.6,1.0 tbsp,0.003
11334,Peppers sweet green cooked boiled drained without salt,135,1.0 cup chopped or strips,0.039
11634,Peppers sweet green freeze-dried,0.4,1.0 tbsp,0.002
11825,Peppers sweet green frozen chopped cooked boiled drained with salt,135,1.0 cup chopped or strips,0.039
11337,Peppers sweet green frozen chopped unprepared,95,0.33 package (10 oz),0.031
11333,Peppers sweet green raw,149,1.0 cup chopped,0.137
11339,Peppers sweet green sauteed,115,1.0 cup chopped,0.097
11916,Peppers sweet red canned solids and liquids,140,1.0 cup halves,0.035
11824,Peppers sweet red cooked boiled drained with salt,12,1.0 tbsp,0.003
11823,Peppers sweet red cooked boiled drained without salt,135,1.0 cup strips,0.039
11931,Peppers sweet red freeze-dried,0.4,1.0 tbsp,0.002
11919,Peppers sweet red frozen chopped boiled drained with salt,135,1.0 cup chopped or strips,0.065
11918,Peppers sweet red frozen chopped boiled drained without salt,135,1.0 cup chopped or strips,0.065
11917,Peppers sweet red frozen chopped unprepared,95,0.33 package (10 oz),0.031
11821,Peppers sweet red raw,149,1.0 cup chopped,0.074
11921,Peppers sweet red sauteed,106,1.0 cup chopped,0.056
11951,Peppers sweet yellow raw,186,1.0 pepper large (3-3/4 long 3 dia),0.058
9264,Persimmons japanese dried,34,1.0 fruit without refuse,0.021
9263,Persimmons japanese raw,168,1.0 fruit (2-1/2 dia),0.044
9265,Persimmons native raw,25,1.0 fruit without refuse,0.009
5155,Pheasant breast meat only raw,85,3.0 oz,0.808
5156,Pheasant leg meat only raw,99,1.0 unit (yield from 1 lb ready-to-eat pheasant),0.858
5153,Pheasant raw meat and skin,85,3.0 oz,0.745
5154,Pheasant raw meat only,85,3.0 oz,0.782
18338,Phyllo dough,28.35,1.0 oz,0.102
7058,Pickle and pimiento loaf pork,38,1.0 slice,0.149
11958,Pickle relish hamburger,15,1.0 tbsp,0.003
11944,Pickle relish hot dog,15,1.0 tbsp,0.007
11945,Pickle relish sweet,15,1.0 tbsp,0.002
11937,Pickles cucumber dill or kosher dill,35,1.0 spear small,0.006
11947,Pickles cucumber dill reduced sodium,35,1.0 spear small,0.006
11941,Pickles cucumber sour,155,1.0 cup,0.014
11946,Pickles cucumber sour low sodium,143,1.0 cup chopped or diced,0.013
11940,Pickles cucumber sweet (includes bread and butter pickles),160,1.0 cup chopped,0.034
11948,Pickles cucumber sweet low sodium (includes bread and butter pickles),6,1.0 slice,0.001
7062,Picnic loaf pork beef,28,1.0 slice (1 oz) (4 x 4 x 3/32 thick),0.15
18943,Pie Crust Cookie-type Chocolate Ready Crust,182,1.0 crust,0.504
18399,Pie crust cookie-type prepared from recipe graham cracker chilled,30,1.0 piece (1/8 of 9 crust),0.061
18401,Pie crust cookie-type prepared from recipe vanilla wafer chilled,129,1.0 cup,0.23
18947,Pie crust deep dish frozen baked made with enriched flour,202,1.0 pie crust (average weight),0.558
18945,Pie crust deep dish frozen unbaked made with enriched flour,225,1.0 pie crust (average weight),0.553
18946,Pie crust refrigerated regular baked,198,1.0 pie crust,0.287
18948,Pie crust refrigerated regular unbaked,229,1.0 pie crust (average weight),0.275
18332,Pie crust standard-type dry mix,28.35,1.0 oz,0.096
18333,Pie crust standard-type dry mix prepared baked,20,1.0 piece (1/8 of 9 crust),0.066
18334,Pie crust standard-type frozen ready-to-bake enriched,18,1.0 piece (1/8 of 9 crust),0.046
18335,Pie crust standard-type frozen ready-to-bake enriched baked,154,1.0 pie crust (average weight of 1 baked crust),0.453
18446,Pie crust standard-type frozen ready-to-bake unenriched,142,1.0 crust single 9,0.258
18336,Pie crust standard-type prepared from recipe baked,23,1.0 piece (1/8 of 9 crust),0.075
18402,Pie crust standard-type prepared from recipe unbaked,24,1.0 piece (1/8 of 9 crust),0.069
19314,Pie fillings canned cherry,74,0.125 can,0.006
18301,Pie apple commercially prepared enriched flour,28.35,1.0 oz,0.025
18443,Pie apple commercially prepared unenriched flour,28.35,1.0 oz,0.025
18302,Pie apple prepared from recipe,28.35,1.0 oz,0.033
18303,Pie banana cream prepared from mix no-bake type,28.35,1.0 oz,0.046
18304,Pie banana cream prepared from recipe,28.35,1.0 oz,0.058
18305,Pie blueberry commercially prepared,28.35,1.0 oz,0.024
18306,Pie blueberry prepared from recipe,28.35,1.0 oz,0.036
18308,Pie cherry commercially prepared,28.35,1.0 oz,0.028
18309,Pie cherry prepared from recipe,28.35,1.0 oz,0.035
18312,Pie chocolate mousse prepared from mix no-bake type,28.35,1.0 oz,0.047
18314,Pie coconut cream prepared from mix no-bake type,28.35,1.0 oz,0.037
18313,Pie coconut creme commercially prepared,28.35,1.0 oz,0.028
18316,Pie coconut custard commercially prepared,28.35,1.0 oz,0.078
18944,Pie Dutch Apple Commercially Prepared,131,0.125 pie 1 pie (1/8 of 9 pie),0.136
18317,Pie egg custard commercially prepared,28.35,1.0 oz,0.076
18444,Pie fried pies cherry,28.35,1.0 oz,0.039
18319,Pie fried pies fruit,28.35,1.0 oz,0.039
18445,Pie fried pies lemon,28.35,1.0 oz,0.039
18320,Pie lemon meringue commercially prepared,28.35,1.0 oz,0.019
18321,Pie lemon meringue prepared from recipe,28.35,1.0 oz,0.055
18322,Pie mince prepared from recipe,28.35,1.0 oz,0.032
18323,Pie peach,28.35,1.0 oz,0.023
18324,Pie pecan commercially prepared,28.35,1.0 oz,0.058
18325,Pie pecan prepared from recipe,28.35,1.0 oz,0.071
18326,Pie pumpkin commercially prepared,28.35,1.0 oz,0.05
18327,Pie pumpkin prepared from recipe,28.35,1.0 oz,0.062
18328,Pie vanilla cream prepared from recipe,28.35,1.0 oz,0.064
16402,Pigeon peas (red gram) mature seeds cooked boiled with salt,168,1.0 cup,0.973
16102,Pigeon peas (red gram) mature seeds cooked boiled without salt,168,1.0 cup,0.973
16101,Pigeon peas (red gram) mature seeds raw,205,1.0 cup,3.809
11943,Pimento canned,12,1.0 tbsp,0.004
9271,Pineapple canned extra heavy syrup pack solids and liquids,260,1.0 cup crushed sliced or chunks,0.023
9270,Pineapple canned heavy syrup pack solids and liquids,254,1.0 cup crushed sliced or chunks,0.023
9268,Pineapple canned juice pack solids and liquids,249,1.0 cup crushed sliced or chunks,0.025
9269,Pineapple canned light syrup pack solids and liquids,252,1.0 cup crushed sliced or chunks,0.023
9267,Pineapple canned water pack solids and liquids,246,1.0 cup crushed sliced or chunks,0.027
9272,Pineapple frozen chunks sweetened,245,1.0 cup chunks,0.029
9266,Pineapple raw all varieties,165,1.0 cup chunks,0.035
21271,PIZZA HUT 12 Cheese Pizza Hand-Tossed Crust,96,1.0 slice,0.638
21272,PIZZA HUT 12 Cheese Pizza Pan Crust,100,1.0 slice,0.615
21273,PIZZA HUT 12 Cheese Pizza THIN N CRISPY Crust,69,1.0 slice,0.549
21274,PIZZA HUT 12 Pepperoni Pizza Hand-Tossed Crust,96,1.0 slice,0.6
21275,PIZZA HUT 12 Pepperoni Pizza Pan Crust,96,1.0 slice,0.541
21276,PIZZA HUT 12 Super Supreme Pizza Hand-Tossed Crust,127,1.0 slice,0.692
21512,PIZZA HUT 14 Cheese Pizza Stuffed Crust,117,1.0 slice,0.749
21298,PIZZA HUT 14 Super Supreme Pizza Hand-Tossed Crust,123,1.0 slice,0.701
21224,Pizza cheese topping regular crust frozen cooked,81,1.0 serving 9 servings per 24 oz package,0.428
21225,Pizza cheese topping rising crust frozen cooked,139,1.0 serving 6 servings per 29.25 oz package,0.919
9278,Plantains cooked,200,1.0 cup mashed,0.054
9277,Plantains raw,148,1.0 cup sliced,0.065
9285,Plums canned purple extra heavy syrup pack solids and liquids,261,1.0 cup pitted,0.021
9284,Plums canned purple heavy syrup pack solids and liquids,258,1.0 cup pitted,0.021
9282,Plums canned purple juice pack solids and liquids,252,1.0 cup pitted,0.028
9283,Plums canned purple light syrup pack solids and liquids,252,1.0 cup pitted,0.02
9281,Plums canned purple water pack solids and liquids,249,1.0 cup pitted,0.02
9291,Plums dried (prunes) uncooked,174,1.0 cup pitted,0.09
9279,Plums raw,165,1.0 cup sliced,0.023
7059,Polish sausage pork,85,3.0 oz,0.458
25026,Popcorn microwave regular (butter) flavor made with palm oil,7.9,1.0 cup,0.034
21415,POPEYES biscuit,60,1.0 biscuit,0.176
21416,POPEYES Coleslaw,120,1.0 package,0.024
21456,POPEYES Fried Chicken Mild Breast meat and skin with breading,194,1.0 breast with skin,1.608
21442,POPEYES Fried Chicken Mild Breast meat only skin and breading removed,132,1.0 breast without skin,1.463
21457,POPEYES Fried Chicken Mild Drumstick meat and skin with breading,76,1.0 drumstick with skin,0.594
21443,POPEYES Fried Chicken Mild Drumstick meat only skin and breading removed,44,1.0 drumstick bone and skin removed,0.446
21458,POPEYES Fried Chicken Mild Thigh meat and skin with breading,138,1.0 thigh with skin,1
21445,POPEYES Fried Chicken Mild Thigh meat only skin and breading removed,83,1.0 thigh thigh without skin,0.761
21459,POPEYES Fried Chicken Mild Wing meat and skin with breading,57,1.0 wing with skin,0.445
21446,POPEYES Fried Chicken Mild Wing meat only skin and breading removed,16,1.0 wing without skin bone and breading,0.177
21417,POPEYES Mild Chicken Strips analyzed 2006,54,1.0 strip,0.421
21418,POPEYES Spicy Chicken Strips analyzed 2006,53,1.0 strip,0.417
18339,Popovers dry mix enriched,28.35,1.0 oz,0.147
18447,Popovers dry mix unenriched,28.35,1.0 oz,0.147
7065,Pork and beef sausage fresh cooked,13,1.0 link (raw dimensions: 4 long x 7/8 dia) cooked,0.062
7957,Pork and turkey sausage pre-cooked,57,1.0 serving,0.281
10981,Pork loin fresh backribs bone-in cooked-roasted lean only,85,3.0 oz,0.853
10980,Pork loin fresh backribs bone-in raw lean only,114,4.0 oz,0.987
7064,Pork sausage link/patty cooked pan-fried,27,1.0 patty,0.179
7953,Pork sausage link/patty fully cooked microwaved,30,1.0 patty,0.162
7967,Pork sausage link/patty fully cooked unheated,23,1.0 link,0.111
7966,Pork sausage link/patty reduced fat cooked pan-fried,85,3.0 oz,0.636
7965,Pork sausage link/patty reduced fat unprepared,85,3.0 oz,0.512
7063,Pork sausage link/patty unprepared,25,1.0 link,0.144
7978,Pork sausage reduced sodium cooked,85,3.0 oz,0.369
10860,Pork cured bacon cooked baked,8.1,1.0 slice cooked,0.115
43378,Pork cured bacon cooked broiled pan-fried or roasted reduced sodium,8,1.0 slice cooked,0.118
10861,Pork cured bacon cooked microwaved,9.1,1.0 slice cooked,0.148
10862,Pork cured bacon pre-sliced cooked pan-fried,11.5,1.0 slice,0.163
10123,Pork cured bacon unprepared,28,1.0 slice raw,0.147
10128,Pork cured breakfast strips raw or unheated,85,3.0 oz,0.385
10132,Pork cured feet pickled,28.35,1.0 oz,0.096
10913,Pork cured ham -- water added rump bone-in separable lean and fat heated roasted,85,1.0 serving (3 oz),0.681
10912,Pork cured ham -- water added rump bone-in separable lean and fat unheated,28.35,1.0 oz,0.157
10865,Pork cured ham -- water added rump bone-in separable lean only heated roasted,85,1.0 serving (3 oz),0.728
10866,Pork cured ham -- water added rump bone-in separable lean only unheated,85,3.0 oz,0.524
10914,Pork cured ham -- water added shank bone-in separable lean and fat heated roasted,85,1.0 serving (3 oz),0.629
10911,Pork cured ham -- water added shank bone-in separable lean and fat unheated,28.35,1.0 oz,0.188
10867,Pork cured ham -- water added shank bone-in separable lean only heated roasted,85,1.0 serving (3 oz),0.711
10885,Pork cured ham -- water added shank bone-in separable lean only unheated,85,3.0 oz,0.634
10915,Pork cured ham -- water added slice bone-in separable lean and fat heated pan-broil,85,1.0 serving (3 oz),0.705
10910,Pork cured ham -- water added slice bone-in separable lean and fat unheated,28.35,1.0 oz,0.177
10868,Pork cured ham -- water added slice bone-in separable lean only heated pan-broil,85,1.0 serving (3 oz),0.75
10886,Pork cured ham -- water added slice bone-in separable lean only unheated,85,3.0 oz,0.591
10916,Pork cured ham -- water added slice boneless separable lean and fat heated pan-broil,85,1.0 serving (3 oz),0.632
10878,Pork cured ham -- water added slice boneless separable lean only heated pan-broil,85,1.0 serving (3 oz),0.64
10917,Pork cured ham -- water added whole boneless separable lean and fat heated roasted,85,1.0 serving (3 oz),0.603
10909,Pork cured ham -- water added whole boneless separable lean and fat unheated,28.35,1.0 oz whole,0.193
10879,Pork cured ham -- water added whole boneless separable lean only heated roasted,85,3.0 oz,0.611
10880,Pork cured ham -- water added whole boneless separable lean only unheated,85,3.0 oz,0.59
10918,Pork cured ham and water product rump bone-in separable lean and fat heated roasted,85,1.0 serving (3 oz),0.659
10908,Pork cured ham and water product rump bone-in separable lean and fat unheated,28.35,1.0 oz rump,0.181
10877,Pork cured ham and water product rump bone-in separable lean only heated roasted,85,1.0 serving (3 oz),0.723
10887,Pork cured ham and water product rump bone-in separable lean only unheated,28.35,1.0 oz,0.203
10919,Pork cured ham and water product shank bone-in separable lean and fat heated roasted,85,1.0 serving (3 oz),0.611
10907,Pork cured ham and water product shank bone-in separable lean and fat unheated,28.35,1.0 oz shank,0.16
10881,Pork cured ham and water product shank bone-in separable lean only heated roasted,85,1.0 serving (3 oz),0.738
10889,Pork cured ham and water product shank bone-in unheated separable lean only,85,3.0 oz,0.596
10920,Pork cured ham and water product slice bone-in separable lean and fat heated pan-broil,85,1.0 serving (3 oz),0.673
10906,Pork cured ham and water product slice bone-in separable lean and fat unheated,28.35,1.0 oz,0.155
10869,Pork cured ham and water product slice bone-in separable lean only heated pan-broil,85,1.0 serving (3 oz),0.711
10888,Pork cured ham and water product slice bone-in separable lean only unheated,85,3.0 oz,0.492
10921,Pork cured ham and water product slice boneless separable lean and fat heated pan-broil,136,1.0 slice,0.82
10870,Pork cured ham and water product slice boneless separable lean only heated pan-broil,138,1.0 slice,0.834
10922,Pork cured ham and water product whole boneless separable lean and fat heated roasted,85,1.0 serving (3 oz),0.472
10905,Pork cured ham and water product whole boneless separable lean and fat unheated,28.35,1.0 oz whole,0.159
10871,Pork cured ham and water product whole boneless separable lean only heated roasted,85,1.0 serving (3 oz),0.472
10872,Pork cured ham and water product whole boneless separable lean only unheated,85,3.0 oz,0.479
10923,Pork cured ham with natural juices rump bone-in separable lean and fat heated roasted,85,1.0 serving (3 oz),0.762
10904,Pork cured ham with natural juices rump bone-in separable lean and fat unheated,28.35,1.0 oz rump,0.222
10873,Pork cured ham with natural juices rump bone-in separable lean only heated roasted,85,1.0 serving (3 oz),0.821
10890,Pork cured ham with natural juices rump bone-in separable lean only unheated,85,3.0 oz,0.772
10924,Pork cured ham with natural juices shank bone-in separable lean and fat heated roasted,85,1.0 serving (3 oz),0.775
