15084,Fish salmon pink canned total can contents,85,3.0 oz,0.689
15181,Fish salmon pink canned without salt solids with bone and liquid,85,3.0 oz,0.656
15212,Fish salmon pink cooked dry heat,85,3.0 oz,0.861
15083,Fish salmon pink raw,85,3.0 oz,0.718
15087,Fish salmon sockeye canned drained solids,85,3.0 oz,0.853
15182,Fish salmon sockeye canned without salt drained solids with bone,85,3.0 oz,0.679
15086,Fish salmon sockeye cooked dry heat,85,3.0 oz,0.923
15085,Fish salmon sockeye raw,28.35,1.0 oz boneless,0.259
15088,Fish sardine Atlantic canned in oil drained solids with bone,149,1.0 cup drained,1.432
15089,Fish sardine Pacific canned in tomato sauce drained solids with bone,89,1.0 cup,0.706
15213,Fish scup cooked dry heat,50,1.0 fillet,0.472
15090,Fish scup raw,85,3.0 oz,0.626
15092,Fish sea bass mixed species cooked dry heat,101,1.0 fillet,0.932
15091,Fish sea bass mixed species raw,129,1.0 fillet,0.929
15214,Fish seatrout mixed species cooked dry heat,85,3.0 oz,0.712
15093,Fish seatrout mixed species raw,85,3.0 oz,0.556
15215,Fish shad american cooked dry heat,144,1.0 fillet,1.22
15094,Fish shad american raw,85,3.0 oz,0.562
15096,Fish shark mixed species cooked batter-dipped and fried,85,3.0 oz,0.637
15095,Fish shark mixed species raw,85,3.0 oz,0.696
15098,Fish sheepshead cooked dry heat,85,3.0 oz,0.864
15097,Fish sheepshead raw,85,3.0 oz,0.671
15100,Fish smelt rainbow cooked dry heat,85,3.0 oz,0.75
15099,Fish smelt rainbow raw,85,3.0 oz,0.585
15102,Fish snapper mixed species cooked dry heat,85,3.0 oz,0.873
15101,Fish snapper mixed species raw,85,3.0 oz,0.681
15216,Fish spot cooked dry heat,50,1.0 fillet,0.463
15103,Fish spot raw,64,1.0 fillet,0.463
15105,Fish sturgeon mixed species cooked dry heat,85,3.0 oz,0.687
15104,Fish sturgeon mixed species raw,85,3.0 oz,0.535
15106,Fish sturgeon mixed species smoked,28.35,1.0 oz,0.345
15217,Fish sucker white cooked dry heat,124,1.0 fillet,1.04
15107,Fish sucker white raw,85,3.0 oz,0.556
15218,Fish sunfish pumpkin seed cooked dry heat,37,1.0 fillet,0.359
15108,Fish sunfish pumpkin seed raw,48,1.0 fillet,0.363
15109,Fish surimi,28.35,1.0 oz,0.169
15111,Fish swordfish cooked dry heat,85,3.0 oz,0.784
15110,Fish swordfish raw,85,3.0 oz,0.657
15262,Fish tilapia cooked dry heat,87,1.0 fillet,0.914
15261,Fish tilapia raw,116,1.0 fillet,0.94
15113,Fish tilefish cooked dry heat,150,0.5 fillet,1.434
15112,Fish tilefish raw,85,3.0 oz,0.581
15219,Fish trout mixed species cooked dry heat,62,1.0 fillet,0.645
15114,Fish trout mixed species raw,79,1.0 fillet,0.641
15241,Fish trout rainbow farmed cooked dry heat,71,1.0 fillet,0.691
15240,Fish trout rainbow farmed raw,79,1.0 fillet,0.644
15116,Fish trout rainbow wild cooked dry heat,143,1.0 fillet,1.28
15115,Fish trout rainbow wild raw,85,3.0 oz,0.679
15128,Fish tuna salad,85,3.0 oz,0.532
15118,Fish tuna fresh bluefin cooked dry heat,85,3.0 oz,0.993
15117,Fish tuna fresh bluefin raw,85,3.0 oz,0.774
15123,Fish tuna fresh skipjack raw,85,3.0 oz,0.73
15127,Fish tuna fresh yellowfin raw,28.35,1.0 oz boneless,0.259
15119,Fish tuna light canned in oil drained solids,146,1.0 cup solid or chunks,1.66
15183,Fish tuna light canned in oil without salt drained solids,85,3.0 oz,0.966
15121,Fish tuna light canned in water drained solids,28.35,1.0 oz,0.206
15184,Fish tuna light canned in water without salt drained solids,85,3.0 oz,0.847
15220,Fish tuna skipjack fresh cooked dry heat,85,3.0 oz,0.936
15124,Fish tuna white canned in oil drained solids,85,3.0 oz,0.881
15185,Fish tuna white canned in oil without salt drained solids,85,3.0 oz,0.881
15126,Fish tuna white canned in water drained solids,85,3.0 oz,0.784
15186,Fish tuna white canned in water without salt drained solids,85,3.0 oz,0.784
15221,Fish tuna yellowfin fresh cooked dry heat,85,3.0 oz,0.927
15222,Fish turbot european cooked dry heat,85,3.0 oz,0.683
15129,Fish turbot european raw,85,3.0 oz,0.533
15223,Fish whitefish mixed species cooked dry heat,85,3.0 oz,0.812
15130,Fish whitefish mixed species raw,85,3.0 oz,0.633
15131,Fish whitefish mixed species smoked,136,1.0 cup cooked,1.243
15133,Fish whiting mixed species cooked dry heat,72,1.0 fillet,0.66
15132,Fish whiting mixed species raw,92,1.0 fillet,0.658
15224,Fish wolffish Atlantic cooked dry heat,119,0.5 fillet,1.042
15134,Fish wolffish Atlantic raw,85,3.0 oz,0.581
15225,Fish yellowtail mixed species cooked dry heat,146,0.5 fillet,1.691
15135,Fish yellowtail mixed species raw,85,3.0 oz,0.768
25045,Formulated bar high fiber chewy oats and chocolate,40,1.0 bar,0.092
25021,Formulated bar LUNA BAR NUTZ OVER CHOCOLATE,48,1.0 bar,0.533
25016,Formulated bar MARS SNACKFOOD US SNICKERS MARATHON Energy Bar all flavors,55,1.0 bar,0.537
25015,Formulated bar MARS SNACKFOOD US SNICKERS MARATHON Protein Performance Bar Caramel Nut Rush,80,1.0 bar,1.07
25017,Formulated bar POWER BAR chocolate,68,1.0 bar,0.503
25020,Formulated bar SLIM-FAST OPTIMA meal bar milk chocolate peanut,55,1.0 bar,0.479
7945,Frankfurter beef heated,48,1.0 frankfurter,0.243
7024,Frankfurter chicken,85,3.0 oz,0.436
7950,Frankfurter meat,52,1.0 serving (1 hot dog),0.231
7963,Frankfurter meat and poultry cooked boiled,50,1.0 frankfurter,0.19
7964,Frankfurter meat and poultry cooked grilled,48,1.0 frankfurter,0.189
7962,Frankfurter meat and poultry unheated,51,1.0 frankfurter,0.183
7949,Frankfurter meat heated,52,1.0 serving (1 hot dog),0.22
7939,Frankfurter pork,76,1.0 link,0.382
7025,Frankfurter turkey,28.35,1.0 oz,0.168
18268,French toast frozen ready-to-heat,28.35,1.0 oz,0.104
18269,French toast prepared from recipe made with low fat (2%) milk,28.35,1.0 oz,0.11
16173,Frijoles rojos volteados (Refried beans red canned),233,1.0 cup,0.645
19240,Frostings chocolate creamy dry mix,388,1.0 package,0.248
19241,Frostings chocolate creamy dry mix prepared with butter,33,2.0 tablespoon,0.018
19372,Frostings chocolate creamy dry mix prepared with margarine,33,2.0 tablespoon,0.018
19226,Frostings chocolate creamy ready-to-eat,41,2.0 tbsp creamy,0.021
19228,Frostings cream cheese-flavor ready-to-eat,33,2.0 tbsp creamy,0
19244,Frostings vanilla creamy dry mix,411,1.0 package,0.053
19371,Frostings vanilla creamy dry mix prepared with margarine,33,2.0 tablespoon,0.005
19246,Frostings white fluffy dry mix,207,1.0 package,0.261
19247,Frostings white fluffy dry mix prepared with water,315,1.0 package yields,0.261
19393,Frozen yogurts chocolate soft-serve,72,0.5 cup (4 fl oz),0.136
19293,Frozen yogurts vanilla soft-serve,72,0.5 cup,0.13
19018,Fruit syrup,334,1.0 cup,0
17330,Game meat  bison ground raw,85,1.0 serving ( 3 oz ),0.674
17332,Game meat  bison top sirloin separable lean only 1 steak cooked broiled,85,1.0 serving ( 3 oz ),1.012
17145,Game meat antelope cooked roasted,85,3.0 oz,0.991
17144,Game meat antelope raw,28.35,1.0 oz,0.251
17151,Game meat beaver cooked roasted,85,3.0 oz,1.204
17150,Game meat beaver raw,28.35,1.0 oz,0.277
17333,Game meat bison chuck shoulder clod separable lean only cooked braised,85,1.0 serving ( 3 oz ),1.219
17334,Game meat bison chuck shoulder clod separable lean only raw,85,1.0 serving ( 3 oz ),0.762
17331,Game meat bison ground cooked pan-broiled,87,1.0 patty ( yield from 112.7 g raw meat ),0.878
17335,Game meat bison ribeye separable lean only 1 steak cooked broiled,85,1.0 serving ( 3 oz ),1.062
17268,Game meat bison ribeye separable lean only trimmed to 0 fat raw,28.35,1.0 oz,0.234
17157,Game meat bison separable lean only cooked roasted,85,3.0 oz,0.905
17156,Game meat bison separable lean only raw,28.35,1.0 oz,0.229
17269,Game meat bison shoulder clod separable lean only trimmed to 0 fat raw,28.35,1.0 oz,0.224
17336,Game meat bison top round separable lean only 1 steak cooked broiled,85,1.0 serving ( 3 oz ),1.089
17337,Game meat bison top round separable lean only 1 steak raw,85,1.0 serving ( 3 oz ),0.842
17267,Game meat bison top sirloin separable lean only trimmed to 0 fat raw,28.35,1.0 oz,0.227
17159,Game meat boar wild cooked roasted,85,3.0 oz,0.962
17158,Game meat boar wild raw,28.35,1.0 oz,0.244
17161,Game meat buffalo water cooked roasted,85,3.0 oz,0.914
17160,Game meat buffalo water raw,28.35,1.0 oz,0.232
17163,Game meat caribou cooked roasted,85,3.0 oz,1.125
17162,Game meat caribou raw,28.35,1.0 oz,0.285
17165,Game meat deer cooked roasted,85,3.0 oz,1.048
17344,Game meat deer ground cooked pan-broiled,93,1.0 patty,0.928
17343,Game meat deer ground raw,85,1.0 patty (cooked from 4 oz raw),0.695
17345,Game meat deer loin separable lean only 1 steak cooked broiled,54,1.0 steak,0.62
17164,Game meat deer raw,28.35,1.0 oz,0.266
17346,Game meat deer shoulder clod separable lean only cooked braised,85,1.0 serving ( 3 oz ),1.153
17347,Game meat deer tenderloin separable lean only cooked broiled,85,1.0 serving ( 3 oz ),0.963
17348,Game meat deer top round separable lean only 1 steak cooked broiled,102,1.0 steak ( yield from 134.9 g raw meat ),1.228
17167,Game meat elk cooked roasted,85,3.0 oz,1.018
17339,Game meat elk ground cooked pan-broiled,95,1.0 patty ( yield from 104.1 g raw meat ),0.926
17338,Game meat elk ground raw,102,1.0 patty ( yield from 102.2 g raw meat ),0.813
17340,Game meat elk loin separable lean only cooked broiled,114,1.0 steak ( yield from 148.1 g raw meat ),1.294
17166,Game meat elk raw,28.35,1.0 oz,0.258
17341,Game meat elk round separable lean only cooked broiled,85,1.0 serving ( 3 oz ),0.963
17342,Game meat elk tenderloin separable lean only cooked broiled,92,1.0 steak ( yield from 123.5 g raw meat ),1.036
17169,Game meat goat cooked roasted,85,3.0 oz,0.8
17171,Game meat horse cooked roasted,85,3.0 oz,0.983
17170,Game meat horse raw,28.35,1.0 oz,0.249
17173,Game meat moose cooked roasted,85,3.0 oz,1.074
17172,Game meat moose raw,28.35,1.0 oz,0.272
17175,Game meat muskrat cooked roasted,85,3.0 oz,1.056
17174,Game meat muskrat raw,28.35,1.0 oz,0.243
17178,Game meat rabbit domesticated composite of cuts cooked roasted,85,3.0 oz,1.014
17179,Game meat rabbit domesticated composite of cuts cooked stewed,85,3.0 oz,1.06
17177,Game meat rabbit domesticated composite of cuts raw,28.35,1.0 oz,0.233
17181,Game meat rabbit wild cooked stewed,85,3.0 oz,1.152
17180,Game meat rabbit wild raw,28.35,1.0 oz,0.254
17184,Game meat squirrel cooked roasted,85,3.0 oz,1.012
17183,Game meat squirrel raw,28.35,1.0 oz,0.233
18963,Garlic bread frozen,43,1.0 slice presliced,0.115
11215,Garlic raw,136,1.0 cup,0.249
19172,Gelatin desserts dry mix,85,1.0 package (3 oz),0.15
19173,Gelatin desserts dry mix prepared with water,135,0.5 cup,0.038
19703,Gelatin desserts dry mix reduced calorie with aspartame added phosphorus potassium sodium vitamin C,9,1.0 tbsp,0.113
19704,Gelatin desserts dry mix reduced calorie with aspartame no added sodium,9,1.0 tbsp,0.113
19702,Gelatin desserts dry mix with added ascorbic acid sodium-citrate and salt,85,1.0 package (3 oz),0.15
19177,Gelatins dry powder unsweetened,7,1.0 envelope (1 tbsp),0.122
11216,Ginger root raw,2,1.0 tsp,0.001
17168,Goat raw,28.35,1.0 oz,0.203
9110,Goji berries dried,28,5.0 tbsp,0.076
5147,Goose domesticated meat and skin cooked roasted,140,1.0 cup chopped or diced,1.477
5146,Goose domesticated meat and skin raw,85,3.0 oz,0.565
5149,Goose domesticated meat only cooked roasted,143,1.0 unit (yield from 1 lb ready-to-cook goose),1.736
5148,Goose domesticated meat only raw,85,3.0 oz,0.811
5150,Goose liver raw,94,1.0 liver,0.766
11784,Gourd white-flowered (calabash) cooked boiled drained with salt,146,1.0 cup (1 cubes),0.02
11219,Gourd white-flowered (calabash) cooked boiled drained without salt,146,1.0 cup (1 cubes),0.02
11218,Gourd white-flowered (calabash) raw,58,0.5 cup (1 pieces),0.009
9512,Grape juice canned or bottled unsweetened with added ascorbic acid and calcium,253,1.0 cup,0.03
9135,Grape juice canned or bottled unsweetened without added ascorbic acid,253,1.0 cup,0.03
9111,Grapefruit raw pink and red and white all areas,230,1.0 cup sections with juice,0.087
9112,Grapefruit raw pink and red all areas,230,1.0 cup sections with juice,0.03
9113,Grapefruit raw pink and red California and Arizona,230,1.0 cup sections with juice,0.069
9114,Grapefruit raw pink and red Florida,230,1.0 cup sections with juice,0.076
9116,Grapefruit raw white all areas,230,1.0 cup sections with juice,0.094
9117,Grapefruit raw white California,230,1.0 cup sections with juice,0.122
9118,Grapefruit raw white Florida,230,1.0 cup sections with juice,0.087
9120,Grapefruit sections canned juice pack solids and liquids,249,1.0 cup,0.105
9121,Grapefruit sections canned light syrup pack solids and liquids,254,1.0 cup,0.086
9119,Grapefruit sections canned water pack solids and liquids,244,1.0 cup,0.085
9131,Grapes american type (slip skin) raw,92,1.0 cup,0.012
9134,Grapes canned thompson seedless heavy syrup pack solids and liquids,256,1.0 cup,0.026
9133,Grapes canned thompson seedless water pack solids and liquids,245,1.0 cup,0.025
9132,Grapes red or green (European type such as Thompson seedless) raw,151,1.0 cup,0.029
6985,Gravy HEINZ Home Style savory beef,57,1.0 serving 1/4 cup 2 oz,0.019
5669,Ground turkey 85% lean 15% fat pan-broiled crumbles,85,3.0 oz,0.833
5670,Ground turkey 85% lean 15% fat patties broiled,85,3.0 oz,0.861
5668,Ground turkey 85% lean 15% fat raw,85,1.0 patty (cooked from 4 oz raw),0.56
5666,Ground turkey 93% lean 7% fat pan-broiled crumbles,85,3.0 oz,0.898
5667,Ground turkey 93% lean 7% fat patties broiled,85,3.0 oz,0.858
5665,Ground turkey 93% lean 7% fat raw,28.35,1.0 oz,0.207
5306,Ground turkey cooked,82,1.0 patty (4 oz raw) (yield after cooking),0.876
5663,Ground turkey fat free pan-broiled crumbles,85,3.0 oz,1.048
5664,Ground turkey fat free patties broiled,85,1.0 patty,0.961
5662,Ground turkey fat free raw,85,1.0 patty (cooked from 4 oz raw),0.778
5305,Ground turkey raw,453.6,1.0 lb,3.47
9143,Guava sauce cooked,238,1.0 cup,0.002
9139,Guavas common raw,165,1.0 cup,0.01
9140,Guavas strawberry raw,244,1.0 cup,0.002
5151,Guinea hen meat and skin raw,85,3.0 oz,0.77
5152,Guinea hen meat only raw,85,3.0 oz,0.696
7032,Ham and cheese loaf or roll,28,1.0 slice (1 oz) (4 x 4 x 3/32 thick),0.193
7033,Ham and cheese spread,15,1.0 tbsp,0.116
7031,Ham salad spread,15,1.0 tbsp,0.053
7026,Ham chopped canned,28.35,1.0 oz,0.176
7030,Ham minced,28.35,1.0 oz,0.182
7029,Ham sliced regular (approximately 11% fat),56,56.0 grams 1 serving,0.278
11961,Hearts of palm canned,146,1.0 cup,0.143
20030,Hominy canned white,165,1.0 cup,0.125
20330,Hominy canned yellow,160,1.0 cup,0.122
19296,Honey,339,1.0 cup,0.037
7088,Honey roll sausage beef,23,1.0 slice (4 dia x 1/8 thick),0.16
22537,HOT POCKETS Ham N Cheese Stuffed Sandwich frozen,127,1.0 serving (1 hot pocket),0.519
22961,HOT POCKETS meatballs  &  mozzarella stuffed sandwich frozen,127,1.0 hot pocket (1 NLEA serving),0.577
16137,Hummus home prepared,15,1.0 tablespoon,0.038
18270,Hush puppies prepared from recipe,28.35,1.0 oz,0.108
16368,Hyacinth beans mature seeds cooked boiled with salt,194,1.0 cup,0.795
16068,Hyacinth beans mature seeds cooked boiled without salt,194,1.0 cup,0.795
16067,Hyacinth beans mature seeds raw,210,1.0 cup,2.528
11788,Hyacinth-beans immature seeds cooked boiled drained with salt,87,1.0 cup,0.057
11225,Hyacinth-beans immature seeds cooked boiled drained without salt,87,1.0 cup,0.057
11224,Hyacinth-beans immature seeds raw,80,1.0 cup,0.037
18271,Ice cream cones cake or wafer-type,28.35,1.0 oz,0.113
18272,Ice cream cones sugar rolled-type,28.35,1.0 oz,0.111
1236,Ice cream soft serve chocolate,86,0.5 cup,0.151
19090,Ice creams french vanilla soft-serve,86,0.5 cup (4 fl oz),0.151
19898,Ice creams regular low carbohydrate vanilla,58,1.0 individual (3.5 fl oz),0.091
19095,Ice creams vanilla,66,1.0 serving 1/2 cup,0.104
19096,Ice creams vanilla light soft-serve,88,1.0 serving 1/2 cup,0.186
19089,Ice creams vanilla rich,107,0.5 cup,0.159
8580,Incaparina dry mix (corn and soy flours) unprepared,8.9,1.0 tbsp,0.116
9144,Jackfruit raw,165,1.0 cup sliced,0.086
19297,Jams and preserves,20,1.0 tbsp,0.004
11789,Jute potherb cooked boiled drained with salt,87,1.0 cup,0.146
11232,Jute potherb cooked boiled drained without salt,87,1.0 cup,0.146
11231,Jute potherb raw,28,1.0 cup,0.059
11790,Kale cooked boiled drained with salt,130,1.0 cup chopped,0.126
11234,Kale cooked boiled drained without salt,130,1.0 cup chopped,0.126
11791,Kale frozen cooked boiled drained with salt,130,1.0 cup chopped,0.19
11236,Kale frozen cooked boiled drained without salt,130,1.0 cup chopped,0.19
11235,Kale frozen unprepared,94,0.333 package (10 oz),0.128
11792,Kale scotch cooked boiled drained with salt,130,1.0 cup chopped,0.126
11623,Kale scotch cooked boiled drained without salt,130,1.0 cup chopped,0.126
11622,Kale scotch raw,67,1.0 cup chopped,0.096
21419,KFC biscuit,49,1.0 biscuit,0.196
21420,KFC Coleslaw,112,1.0 package,0.028
21421,KFC Crispy Chicken Strips,47,1.0 strip,0.396
21438,KFC Fried Chicken EXTRA CRISPY Breast meat and skin with breading,212,1.0 breast with skin,1.721
21430,KFC Fried Chicken EXTRA CRISPY Breast meat only skin and breading removed,140,1.0 breast without skin,1.459
21439,KFC Fried Chicken EXTRA CRISPY Drumstick meat and skin with breading,81,1.0 drumstick with skin,0.639
21431,KFC Fried Chicken EXTRA CRISPY Drumstick meat only skin and breading removed,41,1.0 drumstick bone and skin removed,0.406
21440,KFC Fried Chicken EXTRA CRISPY Thigh meat and skin with breading,152,1.0 thigh with skin,0.999
21432,KFC Fried Chicken EXTRA CRISPY Thigh meat only skin and breading removed,91,1.0 thigh without skin,0.78
21441,KFC Fried Chicken EXTRA CRISPY Wing meat and skin with breading,68,1.0 wing with skin,0.541
21433,KFC Fried Chicken EXTRA CRISPY Wing meat only skin and breading removed,44,1.0 wing without skin,0.482
21434,KFC Fried Chicken ORIGINAL RECIPE Breast meat and skin with breading,212,1.0 breast with skin,1.755
21425,KFC Fried Chicken ORIGINAL RECIPE Breast meat only skin and breading removed,152,1.0 breast without skin,1.563
21435,KFC Fried Chicken ORIGINAL RECIPE Drumstick meat and skin with breading,75,1.0 drumstick with skin,0.632
21426,KFC Fried Chicken ORIGINAL RECIPE Drumstick meat only skin and breading removed,40,1.0 drumstick bone and skin removed,0.402
21436,KFC Fried Chicken ORIGINAL RECIPE Thigh meat and skin with breading,135,1.0 thigh with skin,0.976
21427,KFC Fried Chicken ORIGINAL RECIPE Thigh meat only skin and breading removed,86,1.0 thigh without skin,0.749
21437,KFC Fried Chicken ORIGINAL RECIPE Wing meat and skin with breading,60,1.0 wing with skin,0.498
21428,KFC Fried Chicken ORIGINAL RECIPE Wing meat only skin and breading removed,39,1.0 wing wing without skin,0.427
21422,KFC Popcorn Chicken,6.4,1.0 piece,0.048
7968,Kielbasa fully cooked grilled,85,3.0 oz,0.378
7969,Kielbasa fully cooked pan-fried,370,1.0 link,1.635
7970,Kielbasa fully cooked unheated,85,3.0 oz,0.343
9148,Kiwifruit green raw,180,1.0 cup sliced,0.079
7038,Knackwurst knockwurst pork beef,72,1.0 link,0.361
11793,Kohlrabi cooked boiled drained with salt,165,1.0 cup slices,0.068
11242,Kohlrabi cooked boiled drained without salt,165,1.0 cup slices,0.068
11241,Kohlrabi raw,135,1.0 cup,0.053
17281,Lamb Australian imported fresh composite of trimmed retail cuts separable lean and fat trimmed to 1/8 fat cooked,85,3.0 oz,0.847
17280,Lamb Australian imported fresh composite of trimmed retail cuts separable lean and fat trimmed to 1/8 fat raw,28.35,1.0 oz,0.206
17283,Lamb Australian imported fresh composite of trimmed retail cuts separable lean only trimmed to 1/8 fat cooked,85,3.0 oz,0.923
17282,Lamb Australian imported fresh composite of trimmed retail cuts separable lean only trimmed to 1/8 fat raw,28.35,1.0 oz,0.233
17449,Lamb Australian imported fresh external fat cooked,85,3.0 oz,0.534
17287,Lamb Australian imported fresh foreshank separable lean and fat trimmed to 1/8 fat cooked braised,85,3.0 oz,0.856
17286,Lamb Australian imported fresh foreshank separable lean and fat trimmed to 1/8 fat raw,28.35,1.0 oz,0.217
17289,Lamb Australian imported fresh foreshank separable lean only trimmed to 1/8 fat cooked braised,85,3.0 oz,0.95
17288,Lamb Australian imported fresh foreshank separable lean only trimmed to 1/8 fat raw,28.35,1.0 oz,0.24
17453,Lamb Australian imported fresh leg bottom boneless separable lean and fat trimmed to 1/8 fat cooked roasted,85,3.0 oz,0.87
17454,Lamb Australian imported fresh leg bottom boneless separable lean and fat trimmed to 1/8 fat raw,114,4.0 oz,0.889
17439,Lamb Australian imported fresh leg bottom boneless separable lean only trimmed to 1/8 fat cooked roasted,85,3.0 oz,0.904
17444,Lamb Australian imported fresh leg bottom boneless separable lean only trimmed to 1/8 fat raw,114,4.0 oz,0.944
17307,Lamb Australian imported fresh leg center slice bone-in separable lean and fat trimmed to 1/8 fat cooked broiled,85,3.0 oz,0.882
17306,Lamb Australian imported fresh leg center slice bone-in separable lean and fat trimmed to 1/8 fat raw,28.35,1.0 oz,0.221
17309,Lamb Australian imported fresh leg center slice bone-in separable lean only trimmed to 1/8 fat cooked broiled,85,3.0 oz,0.924
17308,Lamb Australian imported fresh leg center slice bone-in separable lean only trimmed to 1/8 fat raw,28.35,1.0 oz,0.238
17455,Lamb Australian imported fresh leg hindshank heel on bone-in separable lean and fat trimmed to 1/8 fat cooked braised,85,3.0 oz,0.933
17456,Lamb Australian imported fresh leg hindshank heel on bone-in separable lean and fat trimmed to 1/8 fat raw,114,4.0 oz,0.872
17440,Lamb Australian imported fresh leg hindshank heel on bone-in separable lean only trimmed to 1/8 fat cooked braised,85,3.0 oz,0.972
17441,Lamb Australian imported fresh leg hindshank heel on bone-in separable lean only trimmed to 1/8 fat raw,114,4.0 oz,0.953
17295,Lamb Australian imported fresh leg shank half separable lean and fat trimmed to 1/8 fat cooked roasted,85,3.0 oz,0.872
17294,Lamb Australian imported fresh leg shank half separable lean and fat trimmed to 1/8 fat raw,28.35,1.0 oz,0.214
17297,Lamb Australian imported fresh leg shank half separable lean only trimmed to 1/8 fat cooked roasted,85,3.0 oz,0.938
17296,Lamb Australian imported fresh leg shank half separable lean only trimmed to 1/8 fat raw,28.35,1.0 oz,0.236
17303,Lamb Australian imported fresh leg sirloin chops boneless separable lean and fat trimmed to 1/8 fat cooked broiled,85,3.0 oz,0.889
17302,Lamb Australian imported fresh leg sirloin chops boneless separable lean and fat trimmed to 1/8 fat raw,28.35,1.0 oz,0.211
17305,Lamb Australian imported fresh leg sirloin chops boneless separable lean only trimmed to 1/8 fat cooked broiled,85,3.0 oz,0.955
17304,Lamb Australian imported fresh leg sirloin chops boneless separable lean only trimmed to 1/8 fat raw,28.35,1.0 oz,0.235
17299,Lamb Australian imported fresh leg sirloin half boneless separable lean and fat trimmed to 1/8 fat cooked roasted,85,3.0 oz,0.859
17298,Lamb Australian imported fresh leg sirloin half boneless separable lean and fat trimmed to 1/8 fat raw,28.35,1.0 oz,0.199
17301,Lamb Australian imported fresh leg sirloin half boneless separable lean only trimmed to 1/8 fat cooked roasted,85,3.0 oz,0.959
17300,Lamb Australian imported fresh leg sirloin half boneless separable lean only trimmed to 1/8 fat raw,28.35,1.0 oz,0.236
17457,Lamb Australian imported fresh leg trotter off bone-in separable lean and fat trimmed to 1/8 fat cooked roasted,85,3.0 oz,0.953
17458,Lamb Australian imported fresh leg trotter off bone-in separable lean and fat trimmed to 1/8 fat raw,114,4.0 oz,0.93
17445,Lamb Australian imported fresh leg trotter off bone-in separable lean only trimmed to 1/8 fat cooked roasted,85,3.0 oz,1.014
17446,Lamb Australian imported fresh leg trotter off bone-in separable lean only trimmed to 1/8 fat raw,114,4.0 oz,0.979
17291,Lamb Australian imported fresh leg whole (shank and sirloin) separable lean and fat trimmed to 1/8 fat cooked roasted,85,3.0 oz,0.869
17290,Lamb Australian imported fresh leg whole (shank and sirloin) separable lean and fat trimmed to 1/8 fat raw,28.35,1.0 oz,0.21
17293,Lamb Australian imported fresh leg whole (shank and sirloin) separable lean only trimmed to 1/8 fat cooked roasted,85,3.0 oz,0.944
17292,Lamb Australian imported fresh leg whole (shank and sirloin) separable lean only trimmed to 1/8 fat raw,28.35,1.0 oz,0.236
17311,Lamb Australian imported fresh loin separable lean and fat trimmed to 1/8 fat cooked broiled,85,3.0 oz,0.881
17310,Lamb Australian imported fresh loin separable lean and fat trimmed to 1/8 fat raw,28.35,1.0 oz,0.223
17313,Lamb Australian imported fresh loin separable lean only trimmed to 1/8 fat cooked broiled,85,3.0 oz,0.916
17312,Lamb Australian imported fresh loin separable lean only trimmed to 1/8 fat raw,28.35,1.0 oz,0.242
17463,Lamb Australian imported fresh rack roast frenched bone-in separable lean and fat trimmed to 1/8 fat cooked roasted,85,3.0 oz,0.82
17448,Lamb Australian imported fresh rack roast frenched bone-in separable lean only trimmed to 1/8 fat cooked roasted,85,3.0 oz,0.885
17462,Lamb Australian imported fresh rack roast frenched denuded bone-in separable lean and fat trimmed to 0 fat cooked roasted,85,3.0 oz,0.82
17447,Lamb Australian imported fresh rack roast frenched denuded bone-in separable lean only trimmed to 0 fat cooked roasted,85,3.0 oz,0.838
17315,Lamb Australian imported fresh rib chop frenched bone-in separable lean and fat trimmed to 1/8 fat cooked grilled,85,3.0 oz,0.9
17317,Lamb Australian imported fresh rib chop frenched bone-in separable lean only trimmed to 1/8 fat cooked grilled,85,3.0 oz,1.017
17464,Lamb Australian imported fresh rib chop frenched denuded bone-in separable lean and fat trimmed to 0 fat cooked grilled,85,3.0 oz,0.977
17461,Lamb Australian imported fresh rib chop frenched denuded bone-in separable lean only trimmed to 0 fat cooked grilled,85,3.0 oz,1.048
17314,Lamb Australian imported fresh rib chop/rack roast frenched bone-in separable lean and fat trimmed to 1/8 fat raw,114,4.0 oz,0.902
